{
  "$schema": "https://json-schema.org/draft/2020-12/schema",
  "type": "object",
  "properties": {
    "index": {
      "type": "string"
    },
    "name": {
      "type": "string",
      "translatable": true
    },
    "desc": {
      "type": "array",
      "items": {
        "type": "string"
      },
      "translatable": true
    },
    "url": {
      "type": "string"
    }
  },
  "required": [
    "index",
    "name",
    "desc",
    "url"
  ],
  "additionalProperties": false
}
