[
  {
    "index": "blinded",
    "name": "Blinded",
    "desc": [
      "- A blinded creature can't see and automatically fails any ability check that requires sight.",
      "- Attack rolls against the creature have advantage, and the creature's attack rolls have disadvantage."
    ],
    "url": "/api/conditions/blinded"
  },
  {
    "index": "charmed",
    "name": "Charmed",
    "desc": [
      "- A charmed creature can't attack the charmer or target the charmer with harmful abilities or magical effects.",
      "- The charmer has advantage on any ability check to interact socially with the creature."
    ],
    "url": "/api/conditions/charmed"
  },
  {
    "index": "deafened",
    "name": "Deafened",
    "desc": [
      "- A deafened creature can't hear and automatically fails any ability check that requires hearing."
    ],
    "url": "/api/conditions/deafened"
  },
  {
    "index": "frightened",
    "name": "Frightened",
    "desc": [
      "- A frightened creature has disadvantage on ability checks and attack rolls while the source of its fear is within line of sight.",
      "- The creature can't willingly move closer to the source of its fear."
    ],
    "url": "/api/conditions/frightened"
  },
  {
    "index": "grappled",
    "name": "Grappled",
    "desc": [
      "- A grappled creature's speed becomes 0, and it can't benefit from any bonus to its speed.",
      "- The condition ends if the grappler is incapacitated (see the condition).",
      "- The condition also ends if an effect removes the grappled creature from the reach of the grappler or grappling effect, such as when a creature is hurled away by the thunderwave spell."
    ],
    "url": "/api/conditions/grappled"
  },
  {
    "index": "incapacitated",
    "name": "Incapacitated",
    "desc": ["- An incapacitated creature can't take actions or reactions."],
    "url": "/api/conditions/incapacitated"
  },
  {
    "index": "invisible",
    "name": "Invisible",
    "desc": [
      "- An invisible creature is impossible to see without the aid of magic or a special sense. For the purpose of hiding, the creature is heavily obscured. The creature's location can be detected by any noise it makes or any tracks it leaves.",
      "- Attack rolls against the creature have disadvantage, and the creature's attack rolls have advantage."
    ],
    "url": "/api/conditions/invisible"
  },
  {
    "index": "paralyzed",
    "name": "Paralyzed",
    "desc": [
      "- A paralyzed creature is incapacitated (see the condition) and can't move or speak.",
      "- The creature automatically fails Strength and Dexterity saving throws.",
      "- Attack rolls against the creature have advantage.",
      "- Any attack that hits the creature is a critical hit if the attacker is within 5 feet of the creature."
    ],
    "url": "/api/conditions/paralyzed"
  },
  {
    "index": "petrified",
    "name": "Petrified",
    "desc": [
      "- A petrified creature is transformed, along with any nonmagical object it is wearing or carrying, into a solid inanimate substance (usually stone). Its weight increases by a factor of ten, and it ceases aging.",
      "- The creature is incapacitated (see the condition), can't move or speak, and is unaware of its surroundings.",
      "- Attack rolls against the creature have advantage.",
      "- The creature automatically fails Strength and Dexterity saving throws.",
      "- The creature has resistance to all damage.",
      "- The creature is immune to poison and disease, although a poison or disease already in its system is suspended, not neutralized."
    ],
    "url": "/api/conditions/petrified"
  },
  {
    "index": "poisoned",
    "name": "Poisoned",
    "desc": [
      "- A poisoned creature has disadvantage on attack rolls and ability checks."
    ],
    "url": "/api/conditions/poisoned"
  },
  {
    "index": "prone",
    "name": "Prone",
    "desc": [
      "- A prone creature's only movement option is to crawl, unless it stands up and thereby ends the condition.",
      "- The creature has disadvantage on attack rolls.",
      "- An attack roll against the creature has advantage if the attacker is within 5 feet of the creature. Otherwise, the attack roll has disadvantage."
    ],
    "url": "/api/conditions/prone"
  },
  {
    "index": "restrained",
    "name": "Restrained",
    "desc": [
      "- A restrained creature's speed becomes 0, and it can't benefit from any bonus to its speed.",
      "- Attack rolls against the creature have advantage, and the creature's attack rolls have disadvantage.",
      "- The creature has disadvantage on Dexterity saving throws."
    ],
    "url": "/api/conditions/restrained"
  },
  {
    "index": "stunned",
    "name": "Stunned",
    "desc": [
      "- A stunned creature is incapacitated (see the condition), can't move, and can speak only falteringly.",
      "- The creature automatically fails Strength and Dexterity saving throws.",
      "- Attack rolls against the creature have advantage."
    ],
    "url": "/api/conditions/stunned"
  },
  {
    "index": "unconscious",
    "name": "Unconscious",
    "desc": [
      "- An unconscious creature is incapacitated (see the condition), can't move or speak, and is unaware of its surroundings.",
      "- The creature drops whatever it's holding and falls prone.",
      "- The creature automatically fails Strength and Dexterity saving throws.",
      "- Attack rolls against the creature have advantage.",
      "- Any attack that hits the creature is a critical hit if the attacker is within 5 feet of the creature."
    ],
    "url": "/api/conditions/unconscious"
  },
  {
    "index": "exhaustion",
    "name": "Exhaustion",
    "desc": [
      "Some special abilities and environmental hazards, such as starvation and the long-term effects of freezing or scorching temperatures, can lead to a special condition called exhaustion. Exhaustion is measured in six levels. An effect can give a creature one or more levels of exhaustion, as specified in the effect's description.",
      "1 - Disadvantage on ability checks",
      "2 - Speed halved",
      "3 - Disadvantage on attack rolls and saving throws",
      "4 - Hit point maximum halved",
      "5 - Speed reduced to 0",
      "6 - Death",
      "If an already exhausted creature suffers another effect that causes exhaustion, its current level of exhaustion increases by the amount specified in the effect's description.",
      "A creature suffers the effect of its current level of exhaustion as well as all lower levels. For example, a creature suffering level 2 exhaustion has its speed halved and has disadvantage on ability checks.",
      "An effect that removes exhaustion reduces its level as specified in the effect's description, with all exhaustion effects ending if a creature's exhaustion level is reduced below 1.",
      "Finishing a long rest reduces a creature's exhaustion level by 1, provided that the creature has also ingested some food and drink."
    ],
    "url": "/api/conditions/exhaustion"
  },
  {
    "index": "exhaustion-1",
    "name": "Exhaustion 1",
    "desc": [
      "1 - Disadvantage on ability checks, including initiative roll"
    ],
    "url": "/api/conditions/exhaustion-1"
  },
  {
    "index": "exhaustion-2",
    "name": "Exhaustion 2",
    "desc": [
      "1 - Disadvantage on ability checks, including initiative roll",
      "2 - Speed halved"
    ],
    "url": "/api/conditions/exhaustion-2"
  },
  {
    "index": "exhaustion-3",
    "name": "Exhaustion 3",
    "desc": [
      "1 - Disadvantage on ability checks, including initiative roll",
      "2 - Speed halved",
      "3 - Disadvantage on attack rolls and saving throws"
    ],
    "url": "/api/conditions/exhaustion-3"
  },
  {
    "index": "exhaustion-4",
    "name": "Exhaustion 4",
    "desc": [
      "1 - Disadvantage on ability checks, including initiative roll",
      "2 - Speed halved",
      "3 - Disadvantage on attack rolls and saving throws",
      "4 - Hit point maximum halved"
    ],
    "url": "/api/conditions/exhaustion-4"
  },
  {
    "index": "exhaustion-5",
    "name": "Exhaustion 5",
    "desc": [
      "1 - Disadvantage on ability checks, including initiative roll",
      "2 - Speed halved",
      "3 - Disadvantage on attack rolls and saving throws",
      "4 - Hit point maximum halved",
      "5 - Speed reduced to 0"
    ],
    "url": "/api/conditions/exhaustion-5"
  },
  {
    "index": "exhaustion-6",
    "name": "Exhaustion 6",
    "desc": [
      "1 - Disadvantage on ability checks, including initiative roll",
      "2 - Speed halved",
      "3 - Disadvantage on attack rolls and saving throws",
      "4 - Hit point maximum halved",
      "5 - Speed reduced to 0",
      "6 - Death"
    ],
    "url": "/api/conditions/exhaustion-6"
  },
  {
    "index": "enraged",
    "name": "Enraged",
    "desc": [
      "In battle, you fight with primal ferocity. On your turn, you can enter a rage as a bonus action. While raging, you gain the following benefits if you aren't wearing heavy armor:",
      "- You have advantage on Strength checks and Strength saving throws.",
      "- When you make a melee weapon Attack using Strength, you gain a +2 bonus to the damage roll. This bonus increases as you level.",
      "- You have Resistance to bludgeoning, piercing, and slashing damage.",
      "If you are able to cast Spells, you can't cast them or concentrate on them while raging.",
      "Your rage lasts for 1 minute. It ends early if you are knocked Unconscious or if Your Turn ends and you haven't attacked a hostile creature since your last turn or taken damage since then. You can also end your rage on Your Turn as a Bonus Action.",
      "Once you have raged the maximum number of times for your barbarian level, you must finish a Long Rest before you can rage again. You may rage 2 times at 1st level, 3 at 3rd, 4 at 6th, 5 at 12th, and 6 at 17th."
    ],
    "url": "/api/conditions/enraged"
  },
  {